[
  {
    "id": "pm-kisan",
    "name": "PM-KISAN (Pradhan Mantri Kisan Samman Nidhi)",
    "authority": "Ministry of Agriculture & Farmers Welfare",
    "benefit": "₹6,000/year direct income support in 3 installments",
    "category_domain": "agriculture",
    "documents": [
      "Aadhaar card",
      "Land ownership records (khatauni/khasra)",
      "Bank passbook",
      "Passport-size photo"
    ],
    "official_note": "Excludes institutional land holders and certain higher-income categories (e.g. income-tax payers, government employees) per official notification.",
    "source_url": "https://pmkisan.gov.in",
    "review_date": "2026-09-12",
    "exclusions": [
      "Institutional land holders",
      "Income-tax payers (most categories)",
      "Constitutional post holders and serving/retired government employees above Group D"
    ],
    "criteria": {
      "occupations": [
        "farmer"
      ],
      "requires_land": true,
      "match_reason": "You reported farming as your occupation with land holdings: PM-KISAN provides direct income support to landholding farmer families."
    }
  },
  {
    "id": "pmfby",
    "name": "Pradhan Mantri Fasal Bima Yojana (PMFBY)",
    "authority": "Ministry of Agriculture & Farmers Welfare",
    "benefit": "Comprehensive crop loss insurance against non-preventable natural risks at very low premiums (1.5%–2%)",
    "category_domain": "agriculture",
    "documents": [
      "Aadhaar card",
      "Land possession certificate / RoR (Record of Rights)",
      "Sowing certificate / crop declaration",
      "Bank passbook with active account"
    ],
    "official_note": "Mandatory for loanee farmers availing Seasonal Agricultural Operational (SAO) loans, optional for non-loanee farmers.",
    "source_url": "https://pmfby.gov.in",
    "review_date": "2026-09-12",
    "exclusions": [
      "Losses due to war or nuclear risks",
      "Damage caused by malicious intent or avoidable risks"
    ],
    "criteria": {
      "occupations": [
        "farmer"
      ],
      "requires_land": true,
      "match_reason": "You reported farming with land holdings: PMFBY provides low-premium insurance against unavoidable crop damage and climate risks."
    }
  },
  {
    "id": "kisan-credit-card",
    "name": "Kisan Credit Card (KCC)",
    "authority": "Ministry of Agriculture & Farmers Welfare / RBI & NABARD",
    "benefit": "Concessional institutional crop loan credit limit up to ₹3 Lakh at an effective interest rate of 4% (with prompt repayment incentive)",
    "category_domain": "agriculture",
    "documents": [
      "Aadhaar card",
      "Land title / revenue records / lease agreement",
      "Identity and address proof",
      "Passport-size photographs"
    ],
    "official_note": "Also extended to animal husbandry, dairy, and fisheries farmers with credit limits up to ₹2 Lakh.",
    "source_url": "https://agricoop.nic.in",
    "review_date": "2026-09-12",
    "exclusions": [
      "Willful bank loan defaulters"
    ],
    "criteria": {
      "occupations": [
        "farmer"
      ],
      "requires_land": true,
      "match_reason": "You reported farming as your occupation: Kisan Credit Card provides low-interest working capital for seeds, fertilizers, and farm equipment."
    }
  },
  {
    "id": "pm-kmy",
    "name": "Pradhan Mantri Kisan Maan-Dhan Yojana (PM-KMY)",
    "authority": "Ministry of Agriculture & Farmers Welfare",
    "benefit": "Assured minimum monthly pension of ₹3,000 on attaining the age of 60 years",
    "category_domain": "agriculture",
    "documents": [
      "Aadhaar card",
      "Savings bank account passbook / Jan Dhan passbook",
      "Land ownership certificate (cultivable land up to 2 hectares)"
    ],
    "official_note": "A voluntary and contributory pension scheme for small and marginal farmers entering between 18 and 40 years of age.",
    "source_url": "https://maandhan.in",
    "review_date": "2026-09-12",
    "exclusions": [
      "Farmers holding more than 2 hectares (approx. 5 acres) of land",
      "Beneficiaries of other statutory social security schemes like NPS, PM-SYM, EPFO"
    ],
    "criteria": {
      "occupations": [
        "farmer"
      ],
      "requires_land": true,
      "min_age": 18,
      "max_age": 40,
      "match_reason": "You're a farmer in the 18–40 age band with land holdings: PM-KMY guarantees a ₹3,000 monthly old-age pension."
    }
  },
  {
    "id": "pmksy-irrigation",
    "name": "PM Krishi Sinchayee Yojana (Per Drop More Crop - PDMC)",
    "authority": "Ministry of Agriculture & Farmers Welfare",
    "benefit": "Up to 55% capital subsidy for small/marginal farmers (45% for others) on installing drip and sprinkler micro-irrigation systems",
    "category_domain": "agriculture",
    "documents": [
      "Aadhaar card",
      "Land title / 7/12 extract / Khatauni",
      "Electricity bill / water source certificate",
      "Bank passbook"
    ],
    "official_note": "Promotes precision water-use efficiency on agricultural land; states provide additional top-up assistance.",
    "source_url": "https://pmksy.gov.in",
    "review_date": "2026-09-12",
    "exclusions": [
      "Farms without access to an identified water source"
    ],
    "criteria": {
      "occupations": [
        "farmer"
      ],
      "requires_land": true,
      "match_reason": "You reported farming on land holdings: PMKSY offers up to 55% government subsidy for installing drip and sprinkler systems."
    }
  },
  {
    "id": "pkvy-organic",
    "name": "Paramparagat Krishi Vikas Yojana (PKVY)",
    "authority": "Ministry of Agriculture & Farmers Welfare",
    "benefit": "Financial assistance of ₹50,000 per hectare for organic conversion, certification, packaging, and marketing",
    "category_domain": "agriculture",
    "documents": [
      "Aadhaar card",
      "Land ownership record",
      "Bank account details",
      "Panchayat / Farmer Group membership verification"
    ],
    "official_note": "Implemented through cluster formation (minimum 20 hectares or 50 farmers per group).",
    "source_url": "https://pgsindia-ncof.gov.in",
    "review_date": "2026-09-12",
    "exclusions": [],
    "criteria": {
      "occupations": [
        "farmer"
      ],
      "requires_land": true,
      "match_reason": "You reported farming on land holdings: PKVY supports farmers transitioning to chemical-free organic farming with ₹50,000/ha subsidy."
    }
  },
  {
    "id": "ayushman-bharat",
    "name": "Ayushman Bharat PM-JAY",
    "authority": "National Health Authority",
    "benefit": "₹5,00,000/family/year cashless secondary and tertiary health insurance",
    "category_domain": "healthcare",
    "documents": [
      "Aadhaar card",
      "Ration card / SECC household ID",
      "Income certificate"
    ],
    "official_note": "Actual eligibility is based on SECC 2011 deprivation/occupational criteria, not income alone; verify your household on the official PM-JAY beneficiary portal.",
    "source_url": "https://pmjay.gov.in",
    "review_date": "2026-09-12",
    "exclusions": [
      "Households already covered by ESIC/CGHS in most states",
      "Households not on the SECC 2011 deprivation list"
    ],
    "criteria": {
      "max_annual_income": 250000,
      "match_reason": "Your household income falls in the low-income band PM-JAY targets: worth checking your SECC beneficiary status."
    }
  },
  {
    "id": "pmsby",
    "name": "Pradhan Mantri Suraksha Bima Yojana (PMSBY)",
    "authority": "Department of Financial Services",
    "benefit": "₹2 Lakh accident death and permanent disability insurance cover for a nominal premium of ₹20/year",
    "category_domain": "healthcare",
    "documents": [
      "Aadhaar card",
      "Bank or Post Office savings account passbook",
      "Auto-debit authorization form"
    ],
    "official_note": "Auto-debited from the subscriber's bank account annually between May 25 and May 31.",
    "source_url": "https://jansuraksha.gov.in",
    "review_date": "2026-09-12",
    "exclusions": [
      "Individuals below 18 or above 70 years of age"
    ],
    "criteria": {
      "min_age": 18,
      "max_age": 70,
      "max_annual_income": 500000,
      "match_reason": "You're in the 18–70 age group with income under ₹5 Lakh: PMSBY provides ₹2 Lakh accidental insurance for just ₹20 per year."
    }
  },
  {
    "id": "pmjjby",
    "name": "Pradhan Mantri Jeevan Jyoti Bima Yojana (PMJJBY)",
    "authority": "Department of Financial Services",
    "benefit": "₹2 Lakh term life insurance cover for death due to any cause, for a premium of ₹436/year",
    "category_domain": "healthcare",
    "documents": [
      "Aadhaar card",
      "Bank or Post Office savings account passbook",
      "Consent-cum-declaration form"
    ],
    "official_note": "Open to all bank account holders aged 18 to 50; covers death due to any reason.",
    "source_url": "https://jansuraksha.gov.in",
    "review_date": "2026-09-12",
    "exclusions": [
      "Individuals below 18 or above 50 years of age"
    ],
    "criteria": {
      "min_age": 18,
      "max_age": 50,
      "max_annual_income": 500000,
      "match_reason": "You're in the 18–50 age band with income under ₹5 Lakh: PMJJBY provides ₹2 Lakh life insurance protection for your family at ₹436/year."
    }
  },
  {
    "id": "pmgkay-ration",
    "name": "Pradhan Mantri Garib Kalyan Anna Yojana (PMGKAY / NFSA)",
    "authority": "Ministry of Consumer Affairs, Food & Public Distribution",
    "benefit": "5 kg of free foodgrains (wheat/rice) per person per month to Priority Households and 35 kg per Antyodaya (AAY) family",
    "category_domain": "healthcare",
    "documents": [
      "Aadhaar card",
      "Ration card (Priority Household or AAY card)"
    ],
    "official_note": "Cabinet approved free food grain provision for 5 years through 2028 across all Fair Price Shops in India.",
    "source_url": "https://dfpd.gov.in",
    "review_date": "2026-09-12",
    "exclusions": [